{"converter":"jev.data.wikispeedia","converter_version":"0.1.0","created_utc":"2026-09-20T03:36:39Z","criteria_path":"/home/william/Documents/Jev/assets/criteria/wikispeedia.json","criteria_sha256":"32e0488c90a70e5b0603888026959bb86a5eda68c3a1ccca391032ab2a111355","criteria_version":"wikispeedia-v0","dataset":"wikispeedia","format_version":"1","license":"SNAP + Wikipedia CC BY-SA","notes":"skipped_rows=128","primitive":"choice","source":"snap.stanford.edu/data/wikispeedia","split_rule":"split by target article; replay '<' via navigation stack; cap 255 keeping gold","splits":{"calibration":{"n":48951,"n_groups":605,"path":"data/hf-attempt/wikispeedia/jsonl/calibration.jsonl","sha256":"b2cc0692533a3dbcd90980100122e5c0fe3d1fb1892940b3087bab1184afa5e3"},"test":{"n":39786,"n_groups":339,"path":"data/hf-attempt/wikispeedia/jsonl/test.jsonl","sha256":"6bf4e7cea3cd56e697a6f7e7b312c617f79b081dc6f99ca3c65a36993004cf64"},"train":{"n":159134,"n_groups":2082,"path":"data/hf-attempt/wikispeedia/jsonl/train.jsonl","sha256":"0a2433bb75e9e0ac6c32c9d1992f795c0c5018e6f82b47fa55e4d9247b858243"},"validation":{"n":26900,"n_groups":300,"path":"data/hf-attempt/wikispeedia/jsonl/validation.jsonl","sha256":"ea0dba8fd29dfbf3d56b175a2374a67e11be2a6881ada080eafde9ead9294f91"}}}
