{"converter":"jev.data.boolq","converter_version":"0.1.0","created_utc":"2026-09-20T03:22:53Z","criteria_path":"/home/william/Documents/Jev/assets/criteria/boolq.json","criteria_sha256":"01013955e24bb9f102899754154f74f907b4b88de003aeaacc26de71a429420b","criteria_version":"boolq-v0","dataset":"boolq","format_version":"1","license":"CC BY-SA 3.0","notes":"google/boolq has no title column; passage-hash grouping is the leakage control.","primitive":"noul","source":"google/boolq","split_rule":"official validation frozen as test; remaining groups 80/10/10; group_id is Wikipedia title when present, else a hash of the passage (the google/boolq mirror omits title)","splits":{"calibration":{"n":789,"n_groups":731,"path":"data/hf-attempt/boolq/jsonl/calibration.jsonl","sha256":"f82b168ab1c00da97f7d0592445c16812b322accac123ba7e0aeb80ba9ea8432"},"test":{"n":3270,"n_groups":2937,"path":"data/hf-attempt/boolq/jsonl/test.jsonl","sha256":"2e5f18f5bf2ca42d3cf30bbb9b6ba7be27a4a4e5d9b1b2b5a2e463cd514f9e86"},"train":{"n":6410,"n_groups":5760,"path":"data/hf-attempt/boolq/jsonl/train.jsonl","sha256":"323194c0caf286fc7f876934cf303caf6ae70bc1a0cf570d75370d4ffc71bb87"},"validation":{"n":790,"n_groups":709,"path":"data/hf-attempt/boolq/jsonl/validation.jsonl","sha256":"6c73e763ea977d281421e92a2560f9cc1711fcd82a4ffa498e955aec7462e59f"}}}
