{"converter":"jev.data.clinc150","converter_version":"0.1.0","created_utc":"2026-09-20T03:15:13Z","criteria_path":"/home/william/Documents/Jev/assets/criteria/clinc150.json","criteria_sha256":"35487e76f27d8174e182c6df5925b96f0ce98a878a2b5726c36dffa7f5ccfbc7","criteria_version":"clinc150-v0","dataset":"clinc150","format_version":"1","license":"CC BY 3.0","notes":"Includes genuine out_of_scope gold rows.","primitive":"choice","source":"clinc/clinc_oos","split_rule":"official train+test; official validation split even/odd into val/calib","splits":{"calibration":{"n":1550,"n_groups":1550,"path":"data/hf-attempt/clinc150/jsonl/calibration.jsonl","sha256":"a0a4c10ef23c2d7c70dee8c636085226f9d9a37d989c47f2d648d81c754d4b90"},"test":{"n":5500,"n_groups":5500,"path":"data/hf-attempt/clinc150/jsonl/test.jsonl","sha256":"7eded1855dafc2d3fd985b153ebe2641365ed5102e4fe6469b7334be3fe709ab"},"train":{"n":15250,"n_groups":15250,"path":"data/hf-attempt/clinc150/jsonl/train.jsonl","sha256":"2ecfddfb016ce70cbf1962db7321e1006860fe12881d109a990ee8ab5b2da2d6"},"validation":{"n":1550,"n_groups":1550,"path":"data/hf-attempt/clinc150/jsonl/validation.jsonl","sha256":"598d86008e5e2e5dafe4ee4e54191bdfd5766257a07a9e477f1d785fdd220c8c"}}}
