{"converter":"jev.data.sst5","converter_version":"0.1.0","created_utc":"2026-09-20T03:12:58Z","criteria_path":"/home/william/Documents/Jev/assets/criteria/sst5.json","criteria_sha256":"8f5284816b4090e8efe329d0fb9abc924acf43a1603fbc541b9d1c73eafc00e4","criteria_version":"sst5-v0","dataset":"sst5","format_version":"1","license":"LicenseRef-SST-research","notes":"Sentence-level only. Do not shuffle Score level order.","primitive":"score","source":"SetFit/sst5","split_rule":"official test/validation preferred; 10% of train carved as calibration","splits":{"calibration":{"n":857,"n_groups":857,"path":"data/hf-attempt/sst5/jsonl/calibration.jsonl","sha256":"2864ef7a741c54eb995df4a9deba60a23b91439423cf52f4cd3eac8e43ccd6e7"},"test":{"n":2210,"n_groups":2210,"path":"data/hf-attempt/sst5/jsonl/test.jsonl","sha256":"3135caad59f7ba63e484eb73317a700e3d4f963df2c132df31ac1cde6d810b8c"},"train":{"n":7687,"n_groups":7687,"path":"data/hf-attempt/sst5/jsonl/train.jsonl","sha256":"27e8b2321d7c956e50425715ecae2dde8cd000b139b948d013162cd635c27c2f"},"validation":{"n":1101,"n_groups":1101,"path":"data/hf-attempt/sst5/jsonl/validation.jsonl","sha256":"9db46b2398af8f3d663979f5ddc2b762d6852559994eeb3a097642169aadd302"}}}
