{"converter":"jev.data.banking77","converter_version":"0.1.0","created_utc":"2026-09-20T03:12:38Z","criteria_path":"/home/william/Documents/Jev/assets/criteria/banking77.json","criteria_sha256":"b28603936bdd9e857a550d309ed21c7bd7b2c3f1aa3ff073a7429efa51b6cb72","criteria_version":"banking77-v0","dataset":"banking77","format_version":"1","license":"CC BY 4.0","notes":"Do not use intent as group_id. Full 77-option menu on every row.","primitive":"choice","source":"PolyAI/banking77","split_rule":"official test frozen; official train 80/10/10 stratified by intent","splits":{"calibration":{"n":8,"n_groups":8,"path":"data/banking77/jsonl/calibration.jsonl","sha256":"c8a87127920049b6f473e20315d70f1790d68c57a762f368bbc915995b642a14"},"test":{"n":8,"n_groups":8,"path":"data/banking77/jsonl/test.jsonl","sha256":"69e615257cddf535d95db3e54799940e3aaaf3ede1cf4c3aaf9f27abeb0c2e26"},"train":{"n":32,"n_groups":32,"path":"data/banking77/jsonl/train.jsonl","sha256":"c8f51634c3e71596657b8519fb9499e39a0221277d848048e3d0d877b3b7327d"},"validation":{"n":0,"n_groups":0,"path":"data/banking77/jsonl/validation.jsonl","sha256":"e3b0c44298fc1c149afbf4c8996fb92427ae41e4649b934ca495991b7852b855"}}}
