{"converter":"jev.data.wikispeedia","converter_version":"0.1.0","created_utc":"2026-09-20T04:17:09Z","criteria_path":"/home/william/Documents/Jev/assets/criteria/wikispeedia.json","criteria_sha256":"32e0488c90a70e5b0603888026959bb86a5eda68c3a1ccca391032ab2a111355","criteria_version":"wikispeedia-v0","dataset":"wikispeedia","format_version":"1","license":"SNAP + Wikipedia CC BY-SA","notes":"skipped_rows=0","primitive":"choice","source":"tests/fixtures/data/wikispeedia.json","split_rule":"split by target article; replay '<' via navigation stack; cap 255 keeping gold","splits":{"calibration":{"n":0,"n_groups":0,"path":"/tmp/jev-convert-proof/wikispeedia/jsonl/calibration.jsonl","sha256":"e3b0c44298fc1c149afbf4c8996fb92427ae41e4649b934ca495991b7852b855"},"test":{"n":2,"n_groups":1,"path":"/tmp/jev-convert-proof/wikispeedia/jsonl/test.jsonl","sha256":"ed123b1ce6dfdc2a1d44aa0edb85bdbc1fa9e2541889dccc4b16ccfdd577a219"},"train":{"n":4,"n_groups":2,"path":"/tmp/jev-convert-proof/wikispeedia/jsonl/train.jsonl","sha256":"5d79c4163e852c732ec297c3cbd4bc220c3d27321f1b6c704955a1b0c5e0a15f"},"validation":{"n":0,"n_groups":0,"path":"/tmp/jev-convert-proof/wikispeedia/jsonl/validation.jsonl","sha256":"e3b0c44298fc1c149afbf4c8996fb92427ae41e4649b934ca495991b7852b855"}}}
