{"converter":"jev.data.banking77","converter_version":"0.1.0","created_utc":"2026-09-20T04:44:13Z","criteria_path":"/home/william/Documents/Jev/assets/criteria/banking77.json","criteria_sha256":"b28603936bdd9e857a550d309ed21c7bd7b2c3f1aa3ff073a7429efa51b6cb72","criteria_version":"banking77-v0","dataset":"banking77","format_version":"1","license":"CC BY 4.0","notes":"Do not use intent as group_id. Full 77-option menu on every row.","primitive":"choice","source":"mteb/banking77","split_rule":"official test frozen; official train 80/10/10 stratified by intent","splits":{"calibration":{"n":961,"n_groups":961,"path":"data/hf-attempt/banking77/jsonl/calibration.jsonl","sha256":"1dbb98e2189743db9d9eaf1eaed25f07df431acfc2b51f40d7493ce08d7c5ec3"},"test":{"n":3076,"n_groups":3076,"path":"data/hf-attempt/banking77/jsonl/test.jsonl","sha256":"2d24bf08c318a3206e9a916e49421ee6500beb8c3713fac19d94133ab208ed8d"},"train":{"n":8067,"n_groups":8067,"path":"data/hf-attempt/banking77/jsonl/train.jsonl","sha256":"54b47b3ab38e5b9317b958023210cb202c5c62a56aece386fbcff902ed118df8"},"validation":{"n":965,"n_groups":965,"path":"data/hf-attempt/banking77/jsonl/validation.jsonl","sha256":"8f175870d436f0d99b7b56556f968663b34e35d32d153dac80089807fdd20b7a"}}}
