{"converter":"jev.data.sst5","converter_version":"0.1.0","created_utc":"2026-09-20T04:43:38Z","criteria_path":"/home/william/Documents/Jev/assets/criteria/sst5.json","criteria_sha256":"8f5284816b4090e8efe329d0fb9abc924acf43a1603fbc541b9d1c73eafc00e4","criteria_version":"sst5-v0","dataset":"sst5","format_version":"1","license":"LicenseRef-SST-research","notes":"Sentence-level only. Do not shuffle Score level order.","primitive":"score","source":"SetFit/sst5","split_rule":"official test/validation preferred; 10% of train carved as calibration","splits":{"calibration":{"n":5,"n_groups":5,"path":"data/converted-fixtures/sst5/jsonl/calibration.jsonl","sha256":"95766205406fd3a2678a1fff36fd1a417eb430452f4116348bb365e50513ffb1"},"test":{"n":5,"n_groups":5,"path":"data/converted-fixtures/sst5/jsonl/test.jsonl","sha256":"7f720cdcd567fa744d609e200fd48159c0b2b36620000df25611d69bde6fbe1c"},"train":{"n":30,"n_groups":30,"path":"data/converted-fixtures/sst5/jsonl/train.jsonl","sha256":"83fa85cfb93d401b2aa11897acde17a4e8a5a4d74d51684c0093cc1501422546"},"validation":{"n":5,"n_groups":5,"path":"data/converted-fixtures/sst5/jsonl/validation.jsonl","sha256":"a2cc90b5bf02551b4e9c72f8aa8a80044b3166f8815abd2919937896ae38de03"}}}
