{"converter":"jev.data.synthetic","converter_version":"0.1.0","created_utc":"2026-09-20T04:17:30Z","criteria_path":"/home/william/Documents/Jev/assets/criteria/synthetic.json","criteria_sha256":"4ca0840fd66639e673af4ef7e6806ab8ccc5f4d37b715fb22ad7ff2cc8832875","criteria_version":"synthetic-v0","dataset":"synthetic","format_version":"1","license":"generated-in-repo","notes":"","primitive":"choice","source":"jev.data.synthetic.make_synthetic_choice","split_rule":"group_id hashed; ~10% groups held out as test","splits":{"calibration":{"n":48,"n_groups":12,"path":"data/synthetic/jsonl/calibration.jsonl","sha256":"8bbd9080091d7fd7fb94954ad9f0be6f12b274064494bf62379110636c351835"},"test":{"n":12,"n_groups":3,"path":"data/synthetic/jsonl/test.jsonl","sha256":"b28f79c4d4d268df09fd4002f9806375c04951826a5d89c0429563f6622ddf4d"},"train":{"n":172,"n_groups":43,"path":"data/synthetic/jsonl/train.jsonl","sha256":"1e6edee98a916844ebd51c1b6dc97486b2372b82c15bd6e8f4a6959538d3ed3f"},"validation":{"n":24,"n_groups":6,"path":"data/synthetic/jsonl/validation.jsonl","sha256":"1406fef9caebde621b4d816d758eea3985e792d7a9e18231981d71353f8b9885"}}}
