{"converter":"jev.data.boolq","converter_version":"0.1.0","created_utc":"2026-09-20T05:44:54Z","criteria_path":"/home/william/Documents/Jev/assets/criteria/boolq.json","criteria_sha256":"01013955e24bb9f102899754154f74f907b4b88de003aeaacc26de71a429420b","criteria_version":"boolq-v0","dataset":"boolq","format_version":"1","license":"CC BY-SA 3.0","notes":"Original BoolQ jsonl includes Wikipedia titles used as group_id.","primitive":"noul","source":"fixture (titles present)","split_rule":"official validation/dev frozen as test; remaining groups 80/10/10; group_id is Wikipedia title when present, else a hash of the passage (google/boolq omits title; original jsonl includes it)","splits":{"calibration":{"n":3,"n_groups":3,"path":"/home/william/Documents/Jev/data/converted-fixtures/boolq/jsonl/calibration.jsonl","sha256":"61990ce6a3e711abb7ad06a3a33e46287e427cc31fdd0489d0222497d1a6cbdd"},"test":{"n":8,"n_groups":4,"path":"/home/william/Documents/Jev/data/converted-fixtures/boolq/jsonl/test.jsonl","sha256":"f9308dcee7574c3262aa7e66e16ec38d16b9b0fbaffd86f924668e5de4b28ac1"},"train":{"n":38,"n_groups":34,"path":"/home/william/Documents/Jev/data/converted-fixtures/boolq/jsonl/train.jsonl","sha256":"ea91c51a264a86f85cc6d4b7b1e059dfe27d0d5c38bb879c202222a488d81510"},"validation":{"n":3,"n_groups":3,"path":"/home/william/Documents/Jev/data/converted-fixtures/boolq/jsonl/validation.jsonl","sha256":"f8cba678f3755e4591e4cb1e127908626e577a0d3503536fbbd53bb013cb3407"}}}
