{"converter":"jev.data.clinc150","converter_version":"0.1.0","created_utc":"2026-09-20T04:43:41Z","criteria_path":"/home/william/Documents/Jev/assets/criteria/clinc150.json","criteria_sha256":"35487e76f27d8174e182c6df5925b96f0ce98a878a2b5726c36dffa7f5ccfbc7","criteria_version":"clinc150-v0","dataset":"clinc150","format_version":"1","license":"CC BY 3.0","notes":"Includes genuine out_of_scope gold rows.","primitive":"choice","source":"clinc/clinc_oos","split_rule":"official train+test; official validation split even/odd into val/calib","splits":{"calibration":{"n":3,"n_groups":3,"path":"data/converted-fixtures/clinc150/jsonl/calibration.jsonl","sha256":"11f03eeb0a494b515bec1c1fe591af91e74c53fa2eb29871869b875aa5ade86d"},"test":{"n":3,"n_groups":3,"path":"data/converted-fixtures/clinc150/jsonl/test.jsonl","sha256":"c3d5604a295e3706a2b78a36e76d36dc08502d51b6b85fdf75ab66e9b60c9988"},"train":{"n":18,"n_groups":18,"path":"data/converted-fixtures/clinc150/jsonl/train.jsonl","sha256":"4e3be2dc252c9c74671b5c7d394e96097320e806e20b2173e0fbd67ea0fca0b6"},"validation":{"n":3,"n_groups":3,"path":"data/converted-fixtures/clinc150/jsonl/validation.jsonl","sha256":"4dcba272757fa54d66b50b6aff6a6a01493c0dabe2eeff16774525a81ebfb5c2"}}}
